{
  "schema_version": "stage0.rev2",
  "contract_id": "workflow_export_zip_evidence_contract_stage0_rev2",
  "blueprint_source": "Docs/stage0_blueprint_rev2.md",
  "created_by_lane": "lane2",
  "blueprint_sections": [
    "6.1",
    "8.3",
    "15.1",
    "15.3",
    "25.12"
  ],
  "validator": "scripts/validate_workflow_export_zip_evidence_contract.py",
  "workflow_acceptance_ref": "fixtures/stage0/rev2/workflows",
  "runtime_evidence_directory": "ops/evidence/local_alpha",
  "required_export_evidence_assertions": [
    "manifest",
    "qa_report",
    "safety_report",
    "provenance",
    "metadata",
    "ai_disclaimer",
    "trace_payloads",
    "four_option_taxonomy",
    "workflow_required_assets",
    "running_local_stack"
  ],
  "workflow_export_contracts": [
    {
      "workflow_id": "ecommerce_growth_pack",
      "fixture_id": "fx_ecommerce_growth_golden",
      "checklist_item_id": "ecommerce_growth_pack_export_zip",
      "expected_evidence_file": "ops/evidence/local_alpha/ecommerce_growth_pack.export_zip.json",
      "expected_runtime_status": "present_passed",
      "blueprint_checklist_state": "checked",
      "required_export_target_id": "zip_delivery",
      "required_zip_payloads": [
        "manifest.json",
        "qa-report.json",
        "safety-policy-report.json",
        "provenance.json",
        "ai-content-disclaimer.json",
        "ppt-ready-metadata.json",
        "assets/local-rendered-asset-manifest.json",
        "assets/rendered/hero_product_ad-png.svg",
        "assets/rendered/square_social_ad-png.svg",
        "assets/rendered/story_variant-png.svg",
        "assets/rendered/marketplace_banner-png.svg",
        "metadata.json",
        "qa_report.json",
        "trace_provenance.json"
      ],
      "required_asset_payloads": [
        "assets/rendered/hero_product_ad-png.svg",
        "assets/rendered/square_social_ad-png.svg",
        "assets/rendered/story_variant-png.svg",
        "assets/rendered/marketplace_banner-png.svg"
      ],
      "required_manifest_payloads": [
        "manifest.json",
        "metadata.json",
        "qa_report.json",
        "trace_provenance.json"
      ],
      "required_report_payloads": [
        "qa-report.json",
        "qa_report.json",
        "safety-policy-report.json"
      ],
      "required_metadata_payloads": [
        "metadata.json",
        "ppt-ready-metadata.json",
        "provenance.json",
        "ai-content-disclaimer.json",
        "trace_provenance.json"
      ],
      "required_strategy_taxonomy": [
        "conversion_offer",
        "social_proof",
        "feature_comparison",
        "retention_bundle"
      ],
      "closure_contract": {
        "release_gate_check_id": "local_alpha_e2e_workflow_smoke",
        "requires_running_local_stack": true,
        "requires_pass_status": true,
        "missing_file_keeps_checklist_open": true
      }
    },
    {
      "workflow_id": "business_visual_doc_pack",
      "fixture_id": "fx_business_visual_doc_golden",
      "checklist_item_id": "business_visual_doc_pack_export_zip",
      "expected_evidence_file": "ops/evidence/local_alpha/business_visual_doc_pack.export_zip.json",
      "expected_runtime_status": "present_passed",
      "blueprint_checklist_state": "checked",
      "required_export_target_id": "zip_delivery",
      "required_zip_payloads": [
        "manifest.json",
        "qa-report.json",
        "safety-policy-report.json",
        "provenance.json",
        "ai-content-disclaimer.json",
        "ppt-ready-metadata.json",
        "assets/local-rendered-asset-manifest.json",
        "assets/rendered/cover-png.svg",
        "assets/rendered/summary_page-png.svg",
        "assets/rendered/data_page-png.svg",
        "assets/rendered/recommendation_page-png.svg",
        "metadata.json",
        "qa_report.json",
        "trace_provenance.json"
      ],
      "required_asset_payloads": [
        "assets/rendered/cover-png.svg",
        "assets/rendered/summary_page-png.svg",
        "assets/rendered/data_page-png.svg",
        "assets/rendered/recommendation_page-png.svg"
      ],
      "required_manifest_payloads": [
        "manifest.json",
        "metadata.json",
        "qa_report.json",
        "trace_provenance.json"
      ],
      "required_report_payloads": [
        "qa-report.json",
        "qa_report.json",
        "safety-policy-report.json"
      ],
      "required_metadata_payloads": [
        "metadata.json",
        "ppt-ready-metadata.json",
        "provenance.json",
        "ai-content-disclaimer.json",
        "trace_provenance.json"
      ],
      "required_strategy_taxonomy": [
        "executive_brief",
        "strategy_memo",
        "sales_leave_behind",
        "board_update"
      ],
      "closure_contract": {
        "release_gate_check_id": "local_alpha_e2e_workflow_smoke",
        "requires_running_local_stack": true,
        "requires_pass_status": true,
        "missing_file_keeps_checklist_open": true
      }
    },
    {
      "workflow_id": "local_merchant_campaign_pack",
      "fixture_id": "fx_local_merchant_campaign_golden",
      "checklist_item_id": "local_merchant_campaign_pack_export_zip",
      "expected_evidence_file": "ops/evidence/local_alpha/local_merchant_campaign_pack.export_zip.json",
      "expected_runtime_status": "present_passed",
      "blueprint_checklist_state": "checked",
      "required_export_target_id": "zip_delivery",
      "required_zip_payloads": [
        "manifest.json",
        "qa-report.json",
        "safety-policy-report.json",
        "provenance.json",
        "ai-content-disclaimer.json",
        "ppt-ready-metadata.json",
        "assets/local-rendered-asset-manifest.json",
        "assets/rendered/wechat_moment-png.svg",
        "assets/rendered/xiaohongshu_post-png.svg",
        "assets/rendered/store_print_poster-pdf.svg",
        "assets/rendered/delivery_cover-png.svg",
        "metadata.json",
        "qa_report.json",
        "trace_provenance.json"
      ],
      "required_asset_payloads": [
        "assets/rendered/wechat_moment-png.svg",
        "assets/rendered/xiaohongshu_post-png.svg",
        "assets/rendered/store_print_poster-pdf.svg",
        "assets/rendered/delivery_cover-png.svg"
      ],
      "required_manifest_payloads": [
        "manifest.json",
        "metadata.json",
        "qa_report.json",
        "trace_provenance.json"
      ],
      "required_report_payloads": [
        "qa-report.json",
        "qa_report.json",
        "safety-policy-report.json"
      ],
      "required_metadata_payloads": [
        "metadata.json",
        "ppt-ready-metadata.json",
        "provenance.json",
        "ai-content-disclaimer.json",
        "trace_provenance.json"
      ],
      "required_strategy_taxonomy": [
        "wechat_conversion",
        "xiaohongshu_quality",
        "store_print",
        "delivery_platform_cover"
      ],
      "closure_contract": {
        "release_gate_check_id": "local_alpha_e2e_workflow_smoke",
        "requires_running_local_stack": true,
        "requires_pass_status": true,
        "missing_file_keeps_checklist_open": true
      }
    },
    {
      "workflow_id": "character_ip_concept_pack",
      "fixture_id": "fx_character_ip_concept_golden",
      "checklist_item_id": "character_ip_concept_pack_export_zip",
      "expected_evidence_file": "ops/evidence/local_alpha/character_ip_concept_pack.export_zip.json",
      "expected_runtime_status": "present_passed",
      "blueprint_checklist_state": "checked",
      "required_export_target_id": "zip_delivery",
      "required_zip_payloads": [
        "manifest.json",
        "qa-report.json",
        "safety-policy-report.json",
        "provenance.json",
        "ai-content-disclaimer.json",
        "ppt-ready-metadata.json",
        "assets/local-rendered-asset-manifest.json",
        "assets/rendered/avatar-png.svg",
        "assets/rendered/half_body-png.svg",
        "assets/rendered/costume_prop_variants-png.svg",
        "assets/rendered/expression_sheet-png.svg",
        "assets/rendered/promo_key_art-png.svg",
        "assets/character_bible.json",
        "metadata.json",
        "qa_report.json",
        "trace_provenance.json"
      ],
      "required_asset_payloads": [
        "assets/rendered/avatar-png.svg",
        "assets/rendered/half_body-png.svg",
        "assets/rendered/costume_prop_variants-png.svg",
        "assets/rendered/expression_sheet-png.svg",
        "assets/rendered/promo_key_art-png.svg",
        "assets/character_bible.json"
      ],
      "required_manifest_payloads": [
        "manifest.json",
        "metadata.json",
        "qa_report.json",
        "trace_provenance.json"
      ],
      "required_report_payloads": [
        "qa-report.json",
        "qa_report.json",
        "safety-policy-report.json"
      ],
      "required_metadata_payloads": [
        "metadata.json",
        "ppt-ready-metadata.json",
        "provenance.json",
        "ai-content-disclaimer.json",
        "trace_provenance.json"
      ],
      "required_strategy_taxonomy": [
        "cute",
        "heroic",
        "dark",
        "ornate"
      ],
      "closure_contract": {
        "release_gate_check_id": "local_alpha_e2e_workflow_smoke",
        "requires_running_local_stack": true,
        "requires_pass_status": true,
        "missing_file_keeps_checklist_open": true
      }
    }
  ],
  "summary": {
    "workflow_count": 4,
    "closed_export_evidence_count": 4,
    "open_export_evidence_count": 0,
    "runtime_file_required_for_checklist_closure": true,
    "open_workflows_remain_blocked": []
  },
  "provenance": {
    "blueprint_sections": [
      "6.1",
      "8.3",
      "15.1",
      "15.3",
      "25.12"
    ],
    "source_fixtures": [
      "fixtures/stage0/rev2/workflows/ecommerce_growth_pack.json",
      "fixtures/stage0/rev2/workflows/business_visual_doc_pack.json",
      "fixtures/stage0/rev2/workflows/local_merchant_campaign_pack.json",